"Watson Health Imaging - Software Engineer","IBM","San Jose","CA","US","Strong <b>java</b> programming skills. Minimum 2 years’ experience developing in a <b>Java</b> environment and large code base systems....","Mon, 13 Mar 2017 21:56:47 GMT"
"Sr. Developer","Agile","Alpharetta","GA","US","A deep understanding of the .NET platform and/or <b>Java</b> Platform and experience with JEE technologies. Sr....","Mon, 13 Mar 2017 22:20:24 GMT"
"Principal Information Systems Engineer","Nationstar Mortgage","Coppell","TX","US","You will apply your background in enterprise application development using <b>Java</b> and related frameworks to build services that integrate with traditional...","Mon, 13 Mar 2017 21:37:10 GMT"
"Technical Architect: Banking Big data - Hadoop, AWS, .Net","Optima Connections","Charlotte","NC","US","Big Data, Hadoop, Hive, Spark, microservices, MVC, iOS, Android, Angular, Node, Cloud architecture and strategy (AWS, Azure etc) and Containers (Docker etc), C#...","Mon, 13 Mar 2017 11:29:20 GMT"
"Senior Software Engineer, Server-Side Java","Resource Technology Partners","Waltham","MA","US","Senior Software Engineer, Server-Side <b>Java</b>. Working knowledge of <b>Java</b> open source frameworks like Spring, Hibernate is a plus....","Sun, 12 Mar 2017 23:32:17 GMT"
"Software Development Engineer (Mid to Senior level)","scube software square system Inc","Boston","MA","US","4 to 10 + years coding experience with a modern programming language such as <b>Java</b>, C++, Python. Client can sponsor visa for this position and if someone is...","Mon, 13 Mar 2017 20:49:50 GMT"
"Senior Software Engineer (Ad Tech / Blockchain)","MadHive","New York","NY","US","Our prime technologies are in <b>java</b>, python, golang, javascript and ruby running on google cloud. Madhive // Blockchain + Ad Tech:....","Mon, 13 Mar 2017 20:14:52 GMT"
"Senior Security Engineer","Vision Technology Services","Rockville","MD","US","Software &amp; Application Development ( .Net and <b>Java</b> ). Vision Technology Services (Vision) is a leading provider of IT talent and project management services to...","Mon, 13 Mar 2017 17:45:11 GMT"
"Analyst, Business Systems- Contractor","Availity","Indianapolis","IN","US","Understanding of OOD (<b>Java</b>, HTML, XML, <b>Java</b> Script and Patterns) and impact to the development process a plus....","Mon, 13 Mar 2017 18:25:10 GMT"
"Lead Software Develop Engineer","Allegis Global Solutions","Raleigh","NC","US","Enterprise Application Development (EAD) provides customer-centric global technology solutions tailored to meet the needs of businesses across the enterprise,...","Mon, 13 Mar 2017 21:34:58 GMT"
"Senior Java/Spring Developer - 006190","OUTSOURCE Consulting Services, Inc.","Walnut Creek","CA","US","Experience in implementing <b>Java</b> EE design patterns such as MVC, Singleton, Session Facade, DAO, DTO, and Business Delegate in the development of Multi-Tier...","Mon, 13 Mar 2017 21:31:14 GMT"
"Watson Health Imaging - Software Engineer","IBM","San Jose","CA","US","Strong <b>java</b> programming skills. Minimum 2 years’ experience developing in a <b>Java</b> environment and large code base systems....","Mon, 13 Mar 2017 21:56:47 GMT"
"Sr. Developer","Agile","Alpharetta","GA","US","A deep understanding of the .NET platform and/or <b>Java</b> Platform and experience with JEE technologies. Sr....","Mon, 13 Mar 2017 22:20:24 GMT"
"Principal Information Systems Engineer","Nationstar Mortgage","Coppell","TX","US","You will apply your background in enterprise application development using <b>Java</b> and related frameworks to build services that integrate with traditional...","Mon, 13 Mar 2017 21:37:10 GMT"
"Technical Architect: Banking Big data - Hadoop, AWS, .Net","Optima Connections","Charlotte","NC","US","Big Data, Hadoop, Hive, Spark, microservices, MVC, iOS, Android, Angular, Node, Cloud architecture and strategy (AWS, Azure etc) and Containers (Docker etc), C#...","Mon, 13 Mar 2017 11:29:20 GMT"
"Senior Software Engineer, Server-Side Java","Resource Technology Partners","Waltham","MA","US","Senior Software Engineer, Server-Side <b>Java</b>. Working knowledge of <b>Java</b> open source frameworks like Spring, Hibernate is a plus....","Sun, 12 Mar 2017 23:32:17 GMT"
"Senior Backend Engineer","FR8Star","Oakland","CA","US","Either <b>Java</b> or JavaScript (Node.js). We are looking for a Senior Backend Engineer join us on our mission to revolutionize the trucking market....","Mon, 13 Mar 2017 22:58:09 GMT"
"Software Development Engineer (Mid to Senior level)","scube software square system Inc","Boston","MA","US","4 to 10 + years coding experience with a modern programming language such as <b>Java</b>, C++, Python. Client can sponsor visa for this position and if someone is...","Mon, 13 Mar 2017 20:49:50 GMT"
"Senior Software Engineer (Ad Tech / Blockchain)","MadHive","New York","NY","US","Our prime technologies are in <b>java</b>, python, golang, javascript and ruby running on google cloud. Madhive // Blockchain + Ad Tech:....","Mon, 13 Mar 2017 20:14:52 GMT"
"Senior Security Engineer","Vision Technology Services","Rockville","MD","US","Software &amp; Application Development ( .Net and <b>Java</b> ). Vision Technology Services (Vision) is a leading provider of IT talent and project management services to...","Mon, 13 Mar 2017 17:45:11 GMT"
"Senior System Administrator","RCJ Consulting, LLC","Arlington","VA","US","Apply Security Technical Implementation Guides (STIGs) to RHEL 7.1, <b>Java</b>, Tomcat, and PostgreSQL software and services....","Mon, 13 Mar 2017 13:41:47 GMT"
"Senior Software Engineer","Quickbase","Cambridge","MA","US","At least 5 years’ experience designing &amp; developing <b>Java</b> software for web apps and/or software as a service. You’ll be developing tools and templates to enable...","Mon, 13 Mar 2017 19:06:40 GMT"
"Lead JAVA Devloper","HUNTER Technical Resources","Atlanta","GA","US","Lead <b>JAVA</b> Developer. Extensive experience in the design of <b>Java</b> applications through all layers of an. A Senior/Lead <b>Java</b> Developer will be expected to work...","Mon, 13 Mar 2017 22:16:57 GMT"
"Software Solutions Architect","Blue Horizon Tek Solutions","Dallas","TX","US","Architecture experience should include *.NET, <b>Java</b>, LAMP.*. RELOCATION ASSISTANCE WILL BE OFFERED IF OUT OF AREA\*\**....","Sun, 12 Mar 2017 12:20:27 GMT"
"Senior Software Engineer (NYC)","Unified","New York","NY","US","You’d be working heavily in <b>Java</b> building an entirely new platform using a microservices-based architecture....","Sun, 12 Mar 2017 08:12:48 GMT"
"Senior Software Engineer Uber Hacker","Pegasus Solutions","Century City","CA","US","Develop software in a variety of programming languages (C/C++, <b>Java</b>, Scala). Thousands of hotels rely on our scalable enterprise software, distribution, digital...","Sun, 12 Mar 2017 08:11:31 GMT"
"Senior Full Stack Engineer","Fingerprint","San Francisco","CA","US","Fingerprint has built a mobile technology platform that supports networks of linked apps, improving discoverability, monetization, and direct consumer","Sun, 12 Mar 2017 08:13:54 GMT"
"Mid-Level Scala/Spark Big Data Software Engineer (Contract)","Workbridge Associates","San Jose","CA","US","2+ years of professional hands on <b>java</b> development experience. A profitable, stable SaaS Company located in the heart of Silicon Valley is in need of a Mid...","Mon, 13 Mar 2017 20:23:47 GMT"
"Senior Software Engineer – Back End","Bidgely","Silicon Valley","CA","US","Fluency in <b>Java</b>/ C++. Design and deliver scalable web services, APIs and backend data modules....","Sun, 12 Mar 2017 07:19:00 GMT"
"UNIX/Linux Systems Lead","DEPT OF INFO TECH & TELECOMM","Brooklyn","NY","US","Sun <b>Java</b> Web Server, Weblogic &amp; Siebel Server; In-depth installation, configuration, administration and tuning enterprise class servers;...","Sun, 12 Mar 2017 11:00:24 GMT"
"Software Engineer","Technology Partners","St. Louis","MO","US","<b>Java</b>, Scala, etc. Are you looking for a new and challenging opportunity?...","Mon, 13 Mar 2017 16:12:20 GMT"
"Senior Lecturer (JSOM)","University of Texas at Dallas","Richardson","TX","US","Proficiency in MySQL, PHP , <b>Java</b>, <b>Java</b> Script, CSS and HTML and in managing web servers based on Linux OS and Apache is required....","Mon, 13 Mar 2017 18:50:40 GMT"
"Staff Data Engineer","Intuit","Mountain View","CA","US","Advanced OOP programming skills in <b>Java</b>. Description Intuit QuickBooks is on a mission to transform small business lending through its QuickBooks Financing (QBF...","Mon, 13 Mar 2017 10:16:39 GMT"
"Staff Software Engineer, Big Data","Intuit","Mountain View","CA","US","<b>Java</b>, C++, Scala, etc. We are driven to improve our customers’ financial lives so profoundly… they can’t imagine going back to the old way....","Mon, 13 Mar 2017 10:16:39 GMT"
"Digital Solutions Developer, Junior","Booz Allen Hamilton","Herndon","VA","US","GoLang, <b>Java</b>, Spring, React.js, Node.js, or Angular.js. Booz Allen Hamilton has been at the forefront of strategy and technology for more than 100 years Today,...","Mon, 13 Mar 2017 22:26:12 GMT"
"Senior Software Engineer","Jobspring Partners","Chicago","IL","US","Someone who has experience setting up an integration server, building <b>Java</b> libraries, and has experience in a DevOps environment would be ideal....","Mon, 13 Mar 2017 16:16:12 GMT"
"Automated QA Analyst ( HP ALM )","Jack Henry and Associates, Inc.","Birmingham","AL","US",".Net / VB.Net/ VB6 / <b>Java</b> and HTML. The Commercial Lending Management System is an application developed and managed by the Lending Solutions Group (CLMS) and...","Mon, 13 Mar 2017 15:03:31 GMT"
"Automated QA Analyst ( HP ALM )","Jack Henry","Birmingham","AL","US",".Net / VB.Net/ VB6 / <b>Java</b> and HTML. The Commercial Lending Management System is an application developed and managed by the Lending Solutions Group (CLMS) and...","Mon, 13 Mar 2017 14:36:03 GMT"
"Automated QA Analyst ( HP ALM )","Jack Henry","Hoover","AL","US",".Net / VB.Net/ VB6 / <b>Java</b> and HTML. The Commercial Lending Management System is an application developed and managed by the Lending Solutions Group (CLMS) and...","Mon, 13 Mar 2017 14:35:59 GMT"
"IT - Quality Consultant - Highly Specilized","InSys Consulting Services","Eden Prairie","MN","US","Strong programming experience with <b>Java</b> and passion for testing. Minimum of 3 years' experience in Test Automation including planning, assessments, script...","Mon, 13 Mar 2017 22:44:13 GMT"
"Software Engineer/Test Eng","netPolarity","Mountain View","CA","US","Knowledge of <b>Java</b>, Eclipse IDE and similar tools. Own and deliver design, development and maintenance of automated tests....","Mon, 13 Mar 2017 22:11:13 GMT"
"Mobile Software Engineer II","Horizontal Integration","Redwoods","CA","US","4+ years of professional C++, C#, <b>Java</b>, and/or Objective­ C software development ? Mobile Software Engineer II....","Mon, 13 Mar 2017 20:46:56 GMT"
"Capital Markets Production Support Manager","U.S. Bank","Chicago","IL","US","Knowledge of <b>Java</b>. O Contributes to the assessment of software maintenance needs, works with vendor and supply chain management to make sure software...","Mon, 13 Mar 2017 21:26:11 GMT"
"System Engineer-VMware","TEKSystems","Cincinnati","OH","US","Applications - <b>Java</b>, Tomcat, .NET, Oracle Weblogic. High Availability / Enterprise VMware configurations. Top Three Skills:....","Mon, 13 Mar 2017 17:04:11 GMT"
"Hadoop Engineer ( W2 Only )","TEKSystems","Jersey City","NJ","US","Hadoop Engineer Needed ( W2 Only ) Our Fortune 100 client is in need of a Hadoop engineer. This person will be working on application onboarding and multi","Mon, 13 Mar 2017 17:04:09 GMT"
"GTMS Sr. Applications Engineer- Nike Technology","NIKE INC","Beaverton","OR","US","However, we are looking for a candidate who also has strong experience building <b>Java</b> applications and can move seamlessly between UI and Backend work....","Sun, 12 Mar 2017 13:07:05 GMT"
"Software Engineer Intern (Master's)","Symantec","Culver City","CA","US","Work on tasks involving <b>Java</b> programming language. Loves to code in <b>Java</b> and experiment with new open source technologies. Symantec Corporation (NASDAQ:....","Sun, 12 Mar 2017 09:37:36 GMT"
"SENIOR FULL-STACK DEVELOPER","The Select Group","Wilmington","NC","US","8+ years' experience as Full-Stack Software Developer, specifically SQL and <b>Java</b> development on the backend. Code utilizing <b>Java</b>, SQL, and JavaScript in order...","Mon, 13 Mar 2017 16:12:40 GMT"
"Manager, Data Quality and Data Science","Philips","Alpharetta","GA","US","Expert level in <b>Java</b> coding (coding experience). To provide leadership to Software and Hardware Designers and Engineers, on technological competence, while...","Mon, 13 Mar 2017 21:45:09 GMT"
"Software Engineer","Binesta","Bloomington","MN","US","Experience with <b>java</b> scripting libraries jquery, d3js. As a Software Engineer &amp; Analyst, you will not only play a part in creating products that impact lives,...","Mon, 13 Mar 2017 06:24:39 GMT"
"Software Engineer","Synerfac","Linthicum Heights","MD","US","Â€¢ 4+ yearsâ€™ experience using <b>Java</b> and Eclipse. Â€¢ Debug <b>Java</b> code using the Eclipse IDE to understand current implementations,....","Mon, 13 Mar 2017 06:32:20 GMT"
"Software Engineer (Hadoop)","Preferred Systems Solutions, Inc.","Annapolis Junction","MD","US","Knowledge and understanding of common <b>java</b> deployment and configuration for J VMs. Are you a talented SOFTWARE ENGINEER looking for the next step in your career...","Mon, 13 Mar 2017 05:49:54 GMT"
"Java Engineer","Resource Technology Partners","Waltham","MA","US","They have a need for a Mid to SR <b>Java</b> Engineer that likes to work in core <b>Java</b>. My client has built a very complex, read time data intensive platform....","Mon, 13 Mar 2017 05:34:08 GMT"
"Java Software Engineer","Resource Technology Partners","Boston","MA","US","<b>Java</b> Software Engineer. Good knowledge of <b>Java</b>, J2EE, and relational databases required. Currently we are seeking mid- to senior-level <b>Java</b> Software Engineers...","Sun, 12 Mar 2017 23:32:17 GMT"
"Cloud Development And Operations Engineer Skill Level 1","Minerva Engineering","Hanover","MD","US","Within the last five (5) years, a minimum of two (2) years experience programming with <b>Java</b> and deploying applications developed with <b>Java</b> - Demonstrated...","Mon, 13 Mar 2017 20:21:38 GMT"
"Software Test Analyst II for FIS Community Core Solution","FIS","Orlando","FL","US","4 yr + User Interface testing experience - 4 yr + <b>Java</b> Business Logic application testing experience. FIS is seeking a Software Test Analyst II to join our...","Mon, 13 Mar 2017 16:27:33 GMT"
"System Analyst II - Epic Environment Analyst","University of Maryland Medical System","Linthicum Heights","MD","US","UMMS is seeking a System Analyst to assist with downtime maintenance, data courier maintenance, 3rd party loads, and support of Epic’s data environment ....","Mon, 13 Mar 2017 04:26:40 GMT"
"Manager Pricing & Valuation","New York Mercantile Exchange, Inc.","New York","NY","US","Bloomberg, Reuters, Matlab, Calypso, C-Sharp, C++, <b>Java</b>, SQL. The Manager Pricing &amp; Valuation develops, enhances, and maintains pricing methodologies....","Mon, 13 Mar 2017 06:34:45 GMT"
"Full Stack Software Developer - Java / UI","GID Global","Schenectady","NY","US","<b>Java</b> web services. 2+ years <b>Java</b> development experience. Build custom web applications with <b>Java</b> / JS / HTML / CSS. Full Stack Development*....","Mon, 13 Mar 2017 13:39:15 GMT"
"Java Developer","Verizon","Irving","TX","US","Master’s Degree in computer science Five or more years of IT experience in analysis, design, development, documentation, implementing and testing of software...","Mon, 13 Mar 2017 22:05:15 GMT"
"Senior Java Backend Developer","Varteq","Chicago","IL","US","Excellent knowledge of <b>Java</b> and experience in developing <b>Java</b> Enterprise (J2EE) applications. Skills &amp; Requirements....","Mon, 13 Mar 2017 19:54:14 GMT"
"Senior Java Developer (AWS & iOS)","Wavsys, LLC","Bellevue","WA","US","3+ years of experience working in <b>Java</b> and/or Scala. We are looking for a talented Software Development Engineer to create the next generation travel planning...","Sun, 12 Mar 2017 23:36:50 GMT"
"Developer Core Java","Wipro LTD","Middletown","NJ","US","Core <b>Java</b> Desirable Skills:. Expert (5 yrs exp) <b>Java</b> server-side development experience. Python Scripting Job Description:....","Mon, 13 Mar 2017 14:24:10 GMT"
"Senior Java Developer - US Citizen only","DUO2 LLC","Frederick","MD","US","I am looking for core <b>Java</b> coder for my client at Frederick, MD and this position requires US citizenship....","Sun, 12 Mar 2017 07:53:49 GMT"
"Web Developer","MicroHealth, LLC","Herndon","VA","US","Development of Javascript and <b>Java</b> code. The web developer should have experience with JavaScript, Spring Framework, Spring MVC, <b>Java</b>, JQuery, HTML, HTML5, CSS,...","Mon, 13 Mar 2017 16:36:06 GMT"
"Application Development Team Lead","American Airlines","Dallas","TX","US","Architecture, design &amp; development of desktop and web applications using <b>Java</b>, Oracle, SQL Server technologies. Application Development Team Lead....","Mon, 13 Mar 2017 22:26:02 GMT"
"ReactJS Lead","Anagh Technologies Inc.","Quincy","MA","US","⿢ Nice to have experience in <b>Java</b>, J2ee, Core <b>Java</b>, Full-Stack. ⿢ 9+ Years of Software Development Experience....","Mon, 13 Mar 2017 06:04:15 GMT"
"Java Developer","Experis","","VA","US","Experis is in search of a <b>Java</b> / J2EE Developer to join one of our trusted clients in Dulles, VA. Minimum qualifications include 5+ years technical experience,...","Mon, 13 Mar 2017 18:13:06 GMT"
"Senior Java EE Developer","Cyber Delivered","Annapolis Junction","MD","US","We expect demonstrable expertise in <b>Java</b>, and <b>Java</b> based languages. We are a managed security services provider that is currently expanding our <b>Java</b> middleware...","Mon, 13 Mar 2017 10:57:54 GMT"
"Java Developer II (Job ID: WISCJP00011300)","COMPUTER CONSULTANTS INTERNATIONAL, INC.","Madison","WI","US","J2SE Core <b>Java</b> \*. <b>Java</b>, Struts, Spring, Hibernate, Oracle, PL/SQL, JavaScript, and JIRA. Provide production support for mission critical applications including...","Mon, 13 Mar 2017 14:26:13 GMT"
"Java Developer","Netsmart Technologies","Overland Park","KS","US","<b>Java</b> Developer Overview:. 3+ years programming experience developing commercial <b>Java</b> web applications. Netsmart is healthcare’s largest human services and...","Mon, 13 Mar 2017 19:59:16 GMT"
"Java Developer","Netsmart Technologies","Great River","NY","US","<b>Java</b> Developer Overview:. 3+ years programming experience developing commercial <b>Java</b> web applications. Netsmart is healthcare’s largest human services and...","Mon, 13 Mar 2017 19:59:11 GMT"
"Senior Software Developer","RxPrep, Inc.","Manhattan Beach","CA","US","C++ or <b>JAVA</b>:. Master PHP, C++, or <b>Java</b> - Minimum 6 years. We’re looking for a Senior Software Developer who can tackle lifecycle development, including...","Mon, 13 Mar 2017 02:48:39 GMT"
"Application Developer","Mitsubishi UFJ Fund Services","Rockville","MD","US","6++ years (Optional) <b>Java</b> Script. Application Developer – Rockville, MD....","Mon, 13 Mar 2017 22:03:21 GMT"
"Senior Java Developer","Bay State","Wilkes-Barre","PA","US","5+ years advanced computer programming skills in <b>Java</b>, <b>Java</b> Servlet, Javabean, EJB, OO Design, HTML. The client seeks <b>Java</b> developers with significant...","Mon, 13 Mar 2017 22:27:07 GMT"
"Senior Java Developer","CSRA","Alexandria","VA","US","Senior <b>Java</b> Developer. <b>Java</b>, MyBatis, Spring , Oracle, Weblogic. Seeking a Senior <b>Java</b> Developer/Senior Software Engineer to join our team in Alexandria, VA....","Mon, 13 Mar 2017 13:20:22 GMT"
"Application Developer for Curam (Senior Level)","Soul Tree LLC","Washington","DC","US","Analyze business/technical requirements to define the scope of <b>Java</b> development initiatives and integration practices....","Mon, 13 Mar 2017 14:29:40 GMT"
"Software Programmer 3 (Software Developer (IT) 2)","CRGT Inc.","Portland","OR","US","Exposure to other programming languages such as <b>Java</b>. NET MVC 2 or greater. As a leading provider of Information Technology, Training and Engineering services...","Mon, 13 Mar 2017 22:39:20 GMT"
"Software Programmer 3 (Software Developer (IT) 2)","Salient CRGT","Portland","OR","US","Exposure to other programming languages such as <b>Java</b>. NET MVC 2 or greater. As a leading provider of Information Technology, Training and Engineering services...","Mon, 13 Mar 2017 22:10:09 GMT"
"Senior Java Developer","Walmart","Reston","VA","US","4 years hands-on programming experience in <b>Java</b> technology stack. Our team is searching for Senior <b>Java</b> Engineers with the following skills:....","Sun, 12 Mar 2017 11:44:16 GMT"
"Software Developer","Decision Source, Inc.","Brentwood","TN","US","2 or more years of development experience in <b>Java</b> Script ( vanilla), HTML5, and CSS3. Intermediate level experience with development, tuning and debugging <b>Java</b>...","Mon, 13 Mar 2017 20:40:57 GMT"
"UI/Front End Developer (no third party candidates)","Prism Inc.","Rensselaer","NY","US","Familiarity with back-end languages such as <b>Java</b>, experience with <b>Java</b> development a plus. No third party candidates.*....","Mon, 13 Mar 2017 21:08:28 GMT"
"Front End Developer","Cloudious LLC","New York","NY","US","Test driven development experience with <b>Java</b> script unit tests using Jasmine. Front end web developers*....","Mon, 13 Mar 2017 20:30:43 GMT"
"Technology Analyst","Arc Aspicio","Washington","DC","US","Strong technical ability, with interest in learning xlm, <b>java</b>, and other leading technologies. Arc Aspicio is a strategy, management, and technology consulting...","Mon, 13 Mar 2017 20:34:41 GMT"
"Manager, Systems Architect","ROWAN COMPANIES","Houston","TX","US","Proficient with MS SQL, .NET, <b>Java</b>, SharePoint and Power BI integration. The Manager, Systems Architect is responsible for system architecture, development,...","Mon, 13 Mar 2017 03:18:25 GMT"
"Principal Applications Engineer","IDeaS","Bloomington","MN","US","Software development skills with languages and tools such as <b>Java</b>, groovy, grails, SAS, C/C++, svn, git, ant, maven, gradle, JMS, LDAP, SSO, Jenkins, junit, TDD...","Sun, 12 Mar 2017 07:31:01 GMT"
"Data Science Intern (Cleveland, OH)","Dealer Tire","Cleveland","OH","US","Experience using SQL, R, Python, <b>Java</b>, VB, D3 or similar languages. Dealer Tire is an international tire, maintenance, and light-repair product distributor that...","Mon, 13 Mar 2017 14:37:15 GMT"
"Technical Specialist Software Engineer","Chicago Mercantile Exchange Inc.","Chicago","IL","US","Extensive experience with <b>Java</b> and Linux is required. The Technical Specialist Software Engineering independently engineers secure, scalable and reliable...","Mon, 13 Mar 2017 18:35:24 GMT"
"Full Stack Developer - Theme Park - Multiple Positions","TEKSystems","Orlando","FL","US","Ideal candidates will have experience with any of the following technologies - Javascript, <b>Java</b>, Angular, NodeJS, PHP....","Mon, 13 Mar 2017 17:03:42 GMT"
"Senior QA Automation Framework Engineer","Boston Technology Corporation","Boston","MA","US","<b>Java</b> or Python or Groovy:. Development languages like Python, Ruby, Groovy, <b>Java</b>, JavaScript, Jquery. Senior Automation Engineer/Principal automation engineer*....","Mon, 13 Mar 2017 20:46:47 GMT"
"QA with Python Scripting","IT America","Sunnyvale","CA","US","Languages - C, C++, <b>Java</b>, C#, SQL, PL/SQL, Python, <b>Java</b> Script. We are urgently looking for a strong QA resource with extensive Python scripting experience with...","Mon, 13 Mar 2017 20:35:09 GMT"
"Plaza Java Attendant","Intercontinental | Greenwood Hospitality Group","Saint Paul","MN","US","Plaza <b>Java</b> Attendant is responsible for greeting and serving guests beverages and/or food. Incumbent is also responsible for an efficient operation of the...","Mon, 13 Mar 2017 21:56:33 GMT"
"Sr. Java Engineer (Full Stack)","Serverlogic","Portland","OR","US","Experience preferred in <b>Java</b> and JavaScript. Looking for strong <b>Java</b> Engineer with REST APIs, 80% backend 20% front end, any exp with React will be a HUGE plus...","Mon, 13 Mar 2017 08:21:13 GMT"
"QA Analyst 2-ProdDev","Oracle","Redwood Shores","CA","US","Proficient in Core <b>JAVA</b> programming &amp; Automation framework is must. Design continuing maintenance of product quality....","Sun, 12 Mar 2017 16:24:18 GMT"
"Java Engineer","ConsultUSA","Pittsburgh","PA","US","Strong <b>Java</b>, Database, and Design skills. Our Client is seeking a <b>Java</b> Engineer in the Pittsburgh, PA area....","Mon, 13 Mar 2017 23:13:41 GMT"
"AD Scrum Master, Associate","JPMorgan Chase - Asset Management","Jersey City","NJ","US","SQL, UNIX, Citrix, <b>Java</b>, Websphere, Perl (expertise or good knowledge). About JPMorgan Chase....","Mon, 13 Mar 2017 22:16:41 GMT"
"Java Manager","The STEM Consultants","Fremont","MI","US","<b>Java</b> Manager will manage multiple LARGE complex projects in assigned department. In order to be successful in this role, this professional MUST have technical...","Mon, 13 Mar 2017 10:58:37 GMT"
"Data Engineer","Quora","Mountain View","CA","US","2+ years of engineering experience developing in Python and/or <b>Java</b>. Quora is a data-driven company with a wide range of rich data....","Mon, 13 Mar 2017 08:46:19 GMT"
